{
  "module": "technology",
  "issue_date": "2026-09-07",
  "window": {
    "start": "2026-08-31",
    "end": "2026-09-07"
  },
  "items": [
    {
      "id": "technology-001",
      "category": "人工智能模型",
      "original_title": "GPT-6 Astra: A new generation of intelligence",
      "source_name": "OpenAI",
      "source_level": "primary",
      "published_at": "2026-09-03",
      "url": "https://openai.com/index/gpt-6-astra/",
      "summary_zh": "OpenAI 发布 GPT-6 Astra，重点提升电脑操作、网页浏览、软件工程、网络安全与科学研究能力，并先向部分机构开放，再逐步扩展至 ChatGPT 付费用户及 API 等渠道。公司同时表示 Astra 达到其 Preparedness Framework 中网络安全 Critical 能力门槛，因此配套部署更严格的安全措施；相关性能与安全结论均来自 OpenAI 的发布与评测。"
    },
    {
      "id": "technology-002",
      "category": "人工智能模型",
      "original_title": "Claude Fable 5.1 and Mythos 5.1",
      "source_name": "Anthropic",
      "source_level": "primary",
      "published_at": "2026-09-01",
      "url": "https://www.anthropic.com/claude-fable-and-mythos-5-1",
      "summary_zh": "Anthropic 发布 Claude Fable 5.1 与 Mythos 5.1，两者使用相同底层模型，但 Mythos 通过受信任访问计划提供更宽松的网络安全与生命科学防护。公司称 Fable 5.1 在编码、知识工作和长程任务上较前代提升，并把缓存读取价格降至每百万 token 0.25 美元；典型按量计费工作负载成本预计下降约 25%，这些性能与成本比较均为 Anthropic 的测试与估算。"
    },
    {
      "id": "technology-003",
      "category": "医疗人工智能",
      "original_title": "Healthcare organizations can now connect EHR and additional industry data to ChatGPT",
      "source_name": "OpenAI",
      "source_level": "primary",
      "published_at": "2026-09-01",
      "url": "https://openai.com/index/chatgpt-connects-health-records-and-healthcare-sources/",
      "summary_zh": "OpenAI 为 ChatGPT for Healthcare 推出 Epic 电子健康记录集成和 Healthcare Public Data plugin。获授权的医疗机构可在受控工作区内调用患者病历上下文，并结构化访问 ClinicalTrials.gov、CMS Coverage、RxNorm、DailyMed、PubMed 等九类官方医疗数据源；OpenAI 表示这些功能保留现有权限控制，并面向临床、研究与行政工作流使用。"
    },
    {
      "id": "technology-004",
      "category": "语音识别",
      "original_title": "MAI-Transcribe-2 is the fastest, most accurate and cheapest speech recognition model in the world",
      "source_name": "Microsoft AI",
      "source_level": "primary",
      "published_at": "2026-09-03",
      "url": "https://microsoft.ai/news/mai-transcribe-2-is-the-fastest-most-accurate-and-cheapest-speech-recognition-model-in-the-world/",
      "summary_zh": "Microsoft AI 发布 MAI-Transcribe-2，新增说话人区分、可配置转写风格和逐词时间戳，并可通过 Microsoft Foundry 等渠道使用。微软称该模型在覆盖 60 种语言的 FLEURS 测试中平均词错误率为 5.2%，音频转写价格为每小时 0.10 美元；“最快、最准确、最便宜”等比较性结论来自公司的测试和表述。"
    },
    {
      "id": "technology-005",
      "category": "量子计算",
      "original_title": "Diraq and Equinix to Deploy Australia’s First Quantum Computer Inside a Data Centre",
      "source_name": "Equinix",
      "source_level": "primary",
      "published_at": "2026-09-01",
      "url": "https://newsroom.equinix.com/2026-09-01-Diraq-and-Equinix-to-Deploy-Australias-First-Quantum-Computer-Inside-a-Data-Centre",
      "summary_zh": "Diraq 与 Equinix 宣布计划在悉尼商业数据中心部署一台采用 8 个硅自旋量子比特的量子计算机，预计 2026 年 10 月完成安装。双方称整套系统包括低温制冷与控制设备，功耗低于 20 千瓦，将用于测试量子硬件与传统 CPU、GPU 及数据中心网络共同运行；“澳大利亚首台部署于数据中心的量子计算机”等定位来自双方公告。"
    },
    {
      "id": "technology-006",
      "category": "软件供应链安全",
      "original_title": "Multiple trusted publishing configurations for npm",
      "source_name": "GitHub",
      "source_level": "primary",
      "published_at": "2026-09-03",
      "url": "https://github.blog/changelog/2026-09-03-multiple-trusted-publishing-configurations-for-npm/",
      "summary_zh": "GitHub 宣布 npm 可信发布机制的三项更新正式可用：每个软件包可配置多个基于 OIDC 的可信发布流程，暂存版本必须完成恶意软件扫描后才能批准发布，维护者还可在版本页面查看暂存历史。多个配置可分别指定仓库、工作流与环境，使不同发布路径减少对长期 npm 访问令牌的依赖。"
    },
    {
      "id": "technology-007",
      "category": "开发者平台",
      "original_title": "GitHub Actions: Early September 2026 updates",
      "source_name": "GitHub",
      "source_level": "primary",
      "published_at": "2026-09-03",
      "url": "https://github.blog/changelog/2026-09-03-github-actions-early-september-2026-updates/",
      "summary_zh": "GitHub Actions 发布 9 月初平台更新：新增 REST API 以查询托管运行器镜像停止注册和停止运行的时间，为 GITHUB_TOKEN 增加只读访问 Dependabot 警报的独立权限，并为可复用工作流加入用于识别实际定义当前 job 的四个上下文字段。GitHub 表示这些新的可复用工作流上下文字段暂不适用于 GitHub Enterprise Server。"
    }
  ]
}
