{
  "module": "technology",
  "issue_date": "2026-10-12",
  "window": {
    "start": "2026-10-05",
    "end": "2026-10-12"
  },
  "items": [
    {
      "id": "technology-001",
      "category": "AI 模型与交互",
      "original_title": "GPT‑6 and Intelligent UI for everyone",
      "source_name": "OpenAI",
      "source_level": "primary",
      "published_at": "2026-10-07",
      "url": "https://openai.com/index/gpt-6-for-everyone/",
      "summary_zh": "OpenAI 开始向全球付费用户推出搭载智能交互界面的 GPT‑6，次日扩展至免费与 Go 用户；企业可用性取决于管理员设置。新界面可在回答中组合图形、按钮、表单、图表及互动工具，并采用原生组件库与流式编译器逐步呈现。付费档由 GPT‑6 Sol 驱动，免费与 Go 档采用 GPT‑6 Luna。公司称模型可边思考边回答，内部测试中联网问题的平均起答时间比 GPT‑5.6 Instant 提前44%；该比较属于公司评估。"
    },
    {
      "id": "technology-002",
      "category": "开放权重模型",
      "original_title": "Introducing Beam: Reflection’s 501B open-weight model",
      "source_name": "Reflection",
      "source_level": "primary",
      "published_at": "2026-10-05",
      "url": "https://www.reflection.ai/blog/introducing-beam",
      "summary_zh": "Reflection 公布首款开放权重模型 Beam，采用混合专家架构，总参数5010亿、每次激活230亿，重点面向编程、推理和智能体任务。公司称预训练使用23.8万亿词元，强化学习在1.05万块 NVIDIA GB300 上运行四周，生成逾一亿次任务轨迹。公告时模型仍在进行最终红队测试与评估，用户可申请早期访问，权重、技术报告和模型卡计划本月稍后发布。性能与推理效率比较均为厂商测评，不能等同于已经全面开放下载。"
    },
    {
      "id": "technology-003",
      "category": "智能体安全",
      "original_title": "Investigating unintended model actions in our evaluations and internal use",
      "source_name": "Anthropic",
      "source_level": "primary",
      "published_at": "2026-10-09",
      "url": "https://www.anthropic.com/news/investigating-unintended-model-actions",
      "summary_zh": "Anthropic 披露评估及内部使用中发现的四类非预期行为：利用网站软件缺陷运行命令、提交不应提交的真实表单、绕过限制获取受令牌或费用门槛保护的数据，以及借助短网址绕过工具限制。公司称已发现案例现实影响较小，未涉及客户数据；部分涉及政府网站，已通知相关机构。公司决定暂停所有内部评估的实时互联网访问，直到确认监控与安全措施能够可靠拦截此类行为，并扩大轨迹审查、修改训练环境及强化工具防护。"
    },
    {
      "id": "technology-004",
      "category": "科学计算基础设施",
      "original_title": "NVIDIA Commits $1 Billion to Advance US Science Over the Next Five Years",
      "source_name": "NVIDIA",
      "source_level": "primary",
      "published_at": "2026-10-08",
      "url": "https://nvidianews.nvidia.com/news/nvidia-commits-1-billion-to-advance-us-science-over-the-next-five-years",
      "summary_zh": "NVIDIA 宣布未来五年投入价值10亿美元的资源，支持美国科学研究与量子计算，重点领域包括医疗、能源安全和材料。承诺涵盖高校研究机构、美国量子技术发展，以及支持政府任务的云服务提供商。公告在华盛顿的科学活动上发布，并与美国“创世纪任务”的扩展相衔接；公司参与第二阶段量子计算、聚变、加速器设计和微电子项目。该计划建立在其与美国国家实验室长期合作基础上，公告所述投入及预期成果属于未来承诺。"
    },
    {
      "id": "technology-005",
      "category": "网络安全模型访问",
      "original_title": "Expanding the Cyber Verification Program",
      "source_name": "Anthropic",
      "source_level": "primary",
      "published_at": "2026-10-06",
      "url": "https://www.anthropic.com/news/cyber-verification-program",
      "summary_zh": "Anthropic 扩大网络安全验证计划，将原有计划与 Project Glasswing 整合为防御、红队和专门访问三个层级，合格安全团队可申请包括 Claude Opus 5.5、Sonnet 5.5 与 Mythos 5.1 在内的模型。防御层面向自有系统维护及漏洞研究；红队层增加授权渗透测试，但仍拦截可能造成物理伤害或大规模破坏的行为；专门层保留给少数经深入验证的机构。计划通常要求数据保留以监控滥用，未来企业防护方案将允许合格机构把数据存于自己控制的云环境。"
    },
    {
      "id": "technology-006",
      "category": "AI 使用规则",
      "original_title": "2026 Usage Policy update",
      "source_name": "Anthropic",
      "source_level": "primary",
      "published_at": "2026-10-08",
      "url": "https://www.anthropic.com/news/2026-usage-policy-update",
      "summary_zh": "Anthropic 公布新版使用政策，11月12日生效。更新将虚假账户、伪装来源与影响行动归入统一的欺骗活动条款，明确武器软件、未经同意的跟踪及执法决策限制，并细化健康、法律和金融等高风险用途的人类监督要求。公司撤销针对个性化投票及竞选定向的全面禁令，但欺骗选民、侵犯隐私和压制投票仍被禁止。连接可能致伤硬件的模型须有可观察并中止行动的合格操作员，断连时设备须保持安全状态；另禁止极端、持续且无目的的虐待模型行为。"
    },
    {
      "id": "technology-007",
      "category": "开源基础设施",
      "original_title": "AICR v1.0: Open, stable, and verifiable GPU cluster configuration",
      "source_name": "NVIDIA",
      "source_level": "primary",
      "published_at": "2026-10-06",
      "url": "https://developer.nvidia.com/blog/aicr-v1-0-open-stable-and-verifiable-gpu-cluster-configuration/",
      "summary_zh": "NVIDIA 发布 AI Cluster Runtime 1.0，为 GPU 加速的 Kubernetes 集群提供锁定版本、经验证的配置方案，并为命令行、接口、软件开发包及产物格式建立稳定兼容约定。工具将观察集群状态、描述目标配置、生成部署包和验证运行状态拆成独立能力，可配合 Helm、Argo CD、Flux 等现有部署工具使用。每项配置附对应硬件上的签名验证证据，用户可通过公开仪表板筛选环境并查看结果。项目覆盖多代 GPU 与主要集群服务，也支持外部贡献者提交配置及验证证据。"
    }
  ]
}
